{
  "schemaVersion": "1.0",
  "policyId": "policy.landometer.release.2026-09-23.01",
  "scope": "package_release",
  "stores": [
    {
      "trustStoreId": "trust.landometer.release.2026-09-23.01",
      "keys": [
        {
          "keyId": "landometer.release.2026-09-23.01",
          "issuerId": "landometer-release-operator",
          "publicKeySpkiSha256": "0242a576a012482bdbced2992e143f219fbc4cfc47881acd2f4bb49fa89efcab"
        }
      ]
    }
  ]
}
